Clothing ID,Age,Title,Review Text,Rating,Recommended IND,Positive Feedback Count,Division Name,Department Name,Class Name,sentiment_overall,emotional_traits,behavioral_traits,concepts
861,49,A lovely piece to be worn and cherished,This is great  on the model it looks largish  but on me it doesn t  if you re curvier like me  5 10   155  32e  it may be more fitted  long arms with great wrists  design is just as shown  not a sturdy piece  but not cheap looking in any way  i plan to hand wash and not drop coffee down the front so i can wear it for a long time  just what i want to wear on certain days  and more colors would be great  thanks  retailer ,5,1,13,General,Tops,Knits,-6.0,,Gratefulness Organization,"['arm', 'pattern', 'wrist', 'retailer', 'coffee', 'musical composition', 'hand wash', 'model', 'thanks', 'largish', 'colours', 'curvy', 'long', 'unabated', 'great']"
860,42,Flattering tee,This is a really flattering tee for my curves  pretty lace details  i purchased the gray and ordered the wine  the pink looked more peach to me in the store  only reason for 4 stars is that the back material wrinkles easily  true to size  large  for me ,4,1,8,General,Tops,Knits,2.09,,,"['peach', 'wine', 'textile', 'grey', 'pink', 'wrinkle', 'lace', 'store', 'tee', 'size', 'detail', 'star', 'reason', 'curve', 'more']"
867,65,Really soft,I bought the design which has now sold out  of the sailboats and waves along the top  the t shirt is super soft and thin  but  it s not sheer or see through  very light and cool for hot humid summer days  has some nice stretch as well  a really gentle cotton knit     this top does run large  maybe that s so it will be cool and not stick to you  thus  i didn t size down because i don t like clothes too form fitting on super hot days ,5,1,0,General,Tops,Knits,9.6,,,"['jersey', 'cotton', 'pattern', 'stretch', 'top', 'sailboat', 'cover', 'summer', 'size', 'clothing', 'nice', 'gentle', 'humid', 'rank', 'cool']"
860,23,Lovely lace top!,Bought this in green at my local store and fell in love with it  i also tried one in pink and it was a bit sheer which is why i opted for the green color instead  very nice and feminine ,4,1,0,General,Tops,Knits,1.2,Love,,"['precipice', 'pink', 'green', 'store', 'color', 'feminine', 'nice', 'bit']"
860,48,Great detail,I purchased this item as a gift for my wife and she loves it  the quality for the price is great  soft and comfortable  needs to be washed with care but is worth it,5,1,0,General,Tops,Knits,8.39,Like,,"['quality', 'wife', 'item', 'price', 'gift', 'care', 'comfortable', 'worth', 'soft', 'great']"
860,45,,Saw this on the sale rack and decided to try on  i looked like the dancing hypos in the movie fantasia  i am petite and not heavy but this is for very slim and tall people  too much fabric in the peplum part ,1,0,2,General,Tops,Knits,-4.19,,,"['hypodermic', 'dance', 'fantasia', 'peplum', 'framework', 'film', 'sale', 'rack', 'people', 'tiny', 'slim', 'tall', 'part', 'heavy']"
860,54,Amazing product,This product is comfortable and stylish  i love the design and the color print  i can dresss it up and dress it down  it goes with everything and also fits great ,5,1,0,General,Tops,Knits,28.39,,,"['product', 'pattern', 'print', 'dress', 'stylish', 'comfortable', 'color']"
860,31,Odd dimensions,I wanted this tank to work so badly  it was a great deal and so beautiful  unfortunately the top fitted portion ends right below my chest then the shirt flares out so i looked like a cupcake  my belly also showed slightly because the shirt is short  if you have a short torso  this would work great  if not  unfortunately  its not great   tear,2,0,0,General,Tops,Knits,0.2,,,"['shirt', 'belly', 'chest', 'part', 'cupcake', 'flare', 'torso', 'plenty', 'tear', 'tank', 'fitted', 'right', 'short', 'beautiful', 'top']"
860,20,Not for the well endowed,I am 5 8 with curvy  muscular body and 36ddd boobs  the ruffle ends up hitting me right below my breasts and creates the look of being about 6 months pregnant  the beading is beautiful and i wish that it fit ,3,0,0,General,Tops,Knits,4.59,,Violence,"['beading', 'ruffle', 'tit', 'look', 'month', 'busty', 'muscular', 'pregnant', 'beautiful', 'body', 'end']"
860,39,So cute!,I love this  seriously would buy again  i wish it was warmer out so i could wear it,5,1,0,General,Tops,Knits,4.9,,Seriousness,['warm']
860,43,Adorable,I love this top  it is very short and hits at a potentially unflattering area if one has wider hips  the fabric and swing to the  skirt  is adorable ,3,1,0,General,Tops,Knits,-1.6,,,"['fabric', 'hip', 'skirt', 'swing', 'unbecoming', 'adorable', 'area', 'short', 'broad']"
860,51,I wanted to like this...,I wanted to like this top so so so so badly  so badly in fact  that after the first size didn t fit  i ordered two other sizes to make sure  xl  l  m  none of them worked i really wanted to like this top  the online photo makes the clothing look so flattering and the shirt is just not    at least on me  the shirt online on the model looks slimming and a lot longer than the actual piece of the clothing  the beaded work is very beautiful  but short causing the very poofy peplum to start at the mos,1,0,0,General,Tops,Knits,2.29,,Organization,"['shirt', 'clothing', 'peplum', 'clothing', 'photo', 'work', 'size', 'model', 'size', 'slimming', 'beaded', 'flattering', 'piece', 'forty', 'actual']"
860,52,~~so very retailer~~,Absolutely beautiful     usually don t leave reviews here  but this top  material  beading  style  is so gorgeous i would be remiss if i didn t  i have a short torso  so the peplum hit me above the belly button  it s very voluminous  but with the right pants and heels  it is a perfect outfit  as a full time student  i m apt to find retailer expensive   but this purchase was so very much worth it  in terms of sizing  i initially got the s to accommodate my bust  30f  but preferred the xs ,5,1,0,General,Tops,Knits,40.2,,,"['beading', 'trend', 'navel', 'peplum', 'trousers', 'material', 'leave', 'torso', 'student', 'purchase', 'retailer', 'outfit', 'heel', 'review', 'full-time']"
863,60,Sleeves stretch out,I really liked this top when i tried it on but as i wore it the bottom of the sleeves stretched out terrible where they looked worn out from wearing over and over  and since this happened with the first wearing and i paid  88 00 i sent it back  if it hadn t been for that it s a comfy and cute casual top,4,0,3,General,Tops,Knits,2.59,Like,,"['arm', 'wear', 'bottom', 'worn', 'comfortable', 'terrible', 'cute', 'casual', 'cover']"
865,63,"Beautiful, flattering top",Ordered this top online  color is a little more gray than green but it is gorgeous  comfortable and flattering  so much so  i am ordering the navy too  great quality   fabulous with jeans  ,5,1,2,General,Tops,Knits,21.0,,Organization,"['quality', 'color', 'grey', 'navy', 'green', 'jeans', 'gorgeous', 'flattering', 'fabulous', 'comfortable', 'more', 'top']"
865,44,Soft lace and beautiful color,I strongly disagree with the previous reviewer  the shirt in our store was featured in all colors   i chose the burnt orange color to try on and it is was incredibly soft   i felt like i was wearing a t shirt with an easy on and easy off feel  the flow of the shirt allows you to wear out or tuck in   i paired with teal velvet crops and tucked the shirt in for more structure to the outfit  love   ,5,1,0,General,Tops,Knits,0.2,Love,Disagreement Initiative,"['shirt', 'jersey', 'crop', 'store', 'reviewer', 'velvet', 'construction', 'flow', 'outfit', 'teal', 'love', 'burnt', 'more', 'orange', 'color']"
862,35,Nice,Was scared at first to order this product  when i tried it on i was amazed on how good it looks  fits just like the model picture  and the material is awesome ,5,1,0,General,Tops,Knits,8.5,Fear Surprise,Organization,"['photo', 'mannequin', 'material', 'fit', 'product', 'awesome', 'good']"
864,48,Cozy sweater in a boxy style,This would be great on someone with a slim build  it s very true to size  it hits above the hips and runs pretty straight through the body for a boxy look  i loved the color and pointelle detail but on my thicker build it just sort of hung in a too casual way  note that it is the kind of cotton that is likely to stretch with wear  and spring back with cleaning  ,3,1,6,General,Tops,Knits,2.09,,,"['cotton', 'kind', 'body', 'wear', 'color', 'detail', 'spring', 'run', 'hip', 'note', 'size', 'way', 'casual', 'great', 'potential']"
864,64,,Love the blue color  is a bit short  but fine with a tank underneath  i purchased the small  that s what i usually wear ,5,1,2,General,Tops,Knits,10.69,,,"['small', 'color', 'tank', 'bit', 'short', 'blue', 'fine']"
862,32,"Sexy, simple top",I love this top  i got a medium in black on sale  i am 5 8   and 135lbs  the medium fits great  the medium is slightly loose on me through the tummy  which is nice   in my experience  it is not too constraining  contrary to other reviews  however  i think it depends on your body shape  i am a coke bottle  this will be a wardrobe staple for day to day and going out  note  it is too low cut for work wear  very happy with my purchase ,5,1,0,General,Tops,Knits,7.4,Love,,"['Coke', 'wear', 'bottle', 'media', 'tummy', 'work', 'wardrobe', 'staple', 'opposite', 'body', 'purchase', 'shapes', 'review', 'note', 'limiting']"
862,48,Too low cut,Gorgeous color and great price  but too low cut and because of the design  a cami s wouldn t work  disappointed,2,0,1,General,Tops,Knits,-100.0,Disappointment,,"['work', 'design', 'camisole', 'color', 'cost', 'gorgeous', 'frustrated', 'cut', 'abject', 'great']"
864,32,Shorter & smaller than picture/ description,I bought this online  this looked like a sweater that was accidentally shrunk in the dryer  when i received it     i will be returning this ,2,0,0,General,Tops,Knits,-3.09,,,"['sweater', 'dryer']"
862,26,Order up a size!,After reading the reviews about this top being really clingy  i decided to order up a size and purchased a medium  when i took it out of the box today and held it up it looked huge and i thought i had made a mistake  however when i tried it on it actually fit really well  i could see if i had ordered my usual small how it would have clinged to my body in a unflattering way  very happy with the top and thankful for the reviews ,5,1,0,General,Tops,Knits,3.79,Happiness,Disagreement Gratefulness Organization,"['review', 'small', 'sizing', 'error', 'body', 'top', 'foremost', 'grateful', 'clingy', 'unflattering', 'usual', 'medium', 'huge', 'felicitous']"
878,51,,I love sundry clothing  this lightweight fleece is the perfect weight  it keeps you warm enough when it s cold  but not hot when it is milder  it s super soft with nice embroidery  size 1 is a great fit for my 5 1  frame  wear it to hang at home or to go out ,5,1,1,General,Tops,Knits,-2.4,,,"['fleece', 'clothing', 'size', 'exercising weight', 'embroidery', 'fit', 'mixed', 'rack', 'lightweight', 'nice', 'mild', 'complete', 'cold', 'hot', 'warm']"
878,35,Cute!,Love sundry  great quality  if you want a looser more comfy fit size up ,4,1,0,General,Tops,Knits,16.2,,,"['quality', 'sizing', 'comfortable', 'mixed', 'fit', 'great', 'loose']"
867,37,,nan,4,1,0,General,Tops,Knits,0.0,,,['naan']
857,29,,Very pretty top  comfortable and soft but looks nice enough for work ,5,1,0,General Petite,Tops,Knits,36.59,,,"['work', 'nice', 'comfortable', 'soft']"
867,35,,Normally i am a size 10 or 12 but i sized down to a small  still very swingy and beautiful  i bought the pink and the taupe as well  the colors are beautiful and have great texture to hide stains ,5,1,1,General,Tops,Knits,8.5,,,"['color', 'dye', 'pink', 'texture', 'taupe', 'size', 'lilting', 'beautiful', 'beautiful', 'great', 'little']"
878,41,Loved it but big,This runs really big  i usually wear s or m so i got a small but i need the xs in this top and it is sold out  i don t have a store close by  about an hour away  and i hate paying shipping for returns  i will either have to plan a trip to the store or try to exchange for size over the phone  i debated keeping the small but it is really too big      i love the style though ,3,1,0,General,Tops,Knits,-4.69,Hatred,Organization,"['store', 'transport', 'trip', 'phone', 'sizing', 'style', 'hour', 'large']"
867,26,Color better in person,I purchased this top in the taupe color  and it is much prettier in person than it photographs online  it runs about a half size too large  and sits slightly off the shoulders  fun casual top for the fall ,4,1,0,General,Tops,Knits,3.9,Amusement,,"['fun', 'half-size', 'photo', 'taupe', 'shoulder', 'person', 'color', 'top', 'casual', 'pretty', 'fall']"
867,47,Great top!,I got this top in an xs and the fit is great  the top is a little darker than pictured  it looks great with white  kaki and denim ,5,1,0,General,Tops,Knits,3.29,Like,,"['top', 'fit', 'denim', 'persimmon', 'top', 'great', 'dark', 'white']"
867,70,Fabulous top,Fabric is soft  body runs a bit big but falls nicely  length is great for leggings or skinny jeans  overall  wonderful tee shirt ,5,1,0,General,Tops,Knits,38.29,,,"['fabric', 'skinny jeans', 'jersey', 'leggings', 'bit', 'body', 'length', 'fantastic', 'overall', 'soft', 'large']"
867,63,"Wear now along, wear later with a sweater",Ordered the pink in a small  but it ran big   the xs was perfect for my 5 6  medium frame  it is comfortable and the fabric has an interesting texture  looks great with chinos or jeans  might need to get the other color ,5,1,3,General,Tops,Knits,32.09,,,"['fabric', 'texture', 'jeans', 'chinos', 'look', 'pink', 'color', 'medium', 'rack', 'comfortable', 'interesting', 'little', 'perfect', 'large']"
878,48,,Very cute top but runs very very big   im5 ft 5 in tall  120 lbs  i ordered the xs but it was so big it looked like a maternity top   sadly returned the top  otherwise the top was made of good quality fabric ,2,0,2,General,Tops,Knits,4.8,Sadness,,"['maternity', 'fabric', 'peak', 'foot', 'quality', 'large', 'cover', 'cute', 'tall', 'fine']"
860,26,Beautiful fabric!,This top is everything i wanted it to be  the fabric is beautiful  and the fit is flowy and comfortable  i would love to own a u neckline version ,5,1,0,General Petite,Tops,Knits,19.79,,,"['sit', 'neckline', 'version', 'fabric', 'comfortable', 'beautiful', 'top']"
860,56,Great summer t,Great t  great lightweight  almost linen like fabric  a bit on the sheer side  but love the fit and the neckline ,4,1,1,General Petite,Tops,Knits,38.9,,,"['neckline', 'fabric', 'linen', 'fit', 'side', 'lightweight', 'rank', 'bit', 'capital']"
860,39,Cute!,Flattering fit and neckline  too thin to wear without a cami or tank underneath  for me   but i was expecting that  great go to tee ,5,1,2,General Petite,Tops,Knits,-4.9,,,"['camisole', 'neckline', 'fit', 'teeing ground', 'tank', 'flattering', 'thin']"
862,37,Flattering and comfortable!,I love this top  i am always looking for tops that are comfortable and work as basics  the material is super soft and not too clingy  it feels like pajamas  but looks very polished  i am a little wide in the stomach and bust  but this didn t look boxy  i got these in all 3 colors ,5,1,0,General,Tops,Knits,-2.5,,,"['pyjamas', 'stomach', 'breast', 'material', 'look', 'work', 'polished', 'cover', 'clingy', 'boxy', 'comfortable', 'basics', 'color', 'broad', 'all']"
862,33,Beautiful but has flaws,This top is just as beautiful in person as online  however  it has two issues for me  1  it is too short  this might work if you have a short torso  but it would forever show my stomach  2  the fabric has way too much static cling  no matter what i tried  it just clung to my stomach and flared out at the sides  not attractive  in short  if you have a short torso and don t mind battling the static  this truly is a beautiful top ,3,1,1,General,Tops,Knits,-4.59,,,"['stomach', 'torso', 'static', 'fabric', 'static', 'person', 'issue', 'beautiful', 'beautiful', 'attractive', 'short', 'side', 'cover', 'top', 'system']"
862,38,,I really wanted to love this shirt  the fit was great  and the fabric just felt beautiful  luxurious  soft and flowing  but the collar was frayed    in addition  the little keyhole area fabric also had to be carefully handled to make it look smooth and not like bad workmanship  i put it aside to return it  then this morning went to have another look at it  wanting to talk myself back into it  but i can t overlook the fact i d be ordering a new shirt that would look time worn  it may be only this,2,0,1,General,Tops,Knits,0.0,,Concern,"['fabric', 'shirt', 'keyhole', 'soft', 'workmanship', 'flow', 'collar', 'area', 'fit', 'morning', 'fact', 'look', 'luxurious', 'new', 'beautiful']"
862,40,,The material is cheap and looks torn  not as nice as the picture ,1,0,0,General,Tops,Knits,20.1,,,"['material', 'picture', 'torn', 'nice', 'cheap']"
862,53,Great top!,This is a really nice top  especially for the price  i am 5 6   34dd  140 lbs and normally wear a medium in dolan tops  in this top i purchased size small since the gathered front provides ample room for my bust  some reviewers have found this top to be on the  boxy  side  i can see that if you don t size down as i did  i found the medium to have too much fabric and look very baggy whereas the small was perfect  i do wish this top was a tad bit longer and less sheer  though  white tops should be,4,1,4,General,Tops,Knits,3.79,,,"['sizing', 'regular', 'price', 'small', 'fabric', 'room', 'reviewer', 'way', 'movement', 'ample', 'tad', 'skint', 'gathered', 'cover', 'top']"
862,43,Soft and relaxed fit,I bought this shirt in the rust color along with the blue black sweater skirt after seeing it on display in the store  not sure i would have ever put those 2 together but i love the outfit  i m not much of a shirt tucker  either  but this shirt works either way  tucked in a skirt or more casual with jeans  my only criticism is the static cling in the front  as mentioned by another reviewer  i had thought of getting it in white  but if it s shear  then maybe not  haven t been wearing a tank under,4,1,1,General,Tops,Knits,2.09,,,"['shirt', 'skirt', 'outfit', 'sweater', 'tucker', 'jeans', 'store', 'haven', 'route', 'criticism', 'rust', 'cling', 'display device', 'reviewer', 'tank']"
860,37,Pretty and nicely cut,The bright poppy red is gorgeous and the cut flattering and interesting  i m usually between a m and l in tops but went with a s in this one because it looked too sloppy in my usual size  i m a 32 34 d with arms that aren t tiny  and it s a bit tight across the shoulders when i reach forward but not enough to be a problem  in the smaller size it skims my hips nicely but isn t as long as pictured on the model  i would suggest pear shaped girls size down if in between  it is sheer but not so much,4,1,1,General Petite,Tops,Knits,0.69,,,"['pear', 'size', 'rosehip', 'poppy', 'girl', 'red', 'shoulder', 'arm', 'model', 'problem', 'tiny', 'size', 'sloppy', 'gorgeous', 'flattering']"
860,33,Flattering and easy,I tried this top because i loved the not so simple  simpleness of it  however  it was a miss for me  loved the fit and style  which i d say is pretty true to size  i just didn t love the color on me  i went for the orange one and the color was a bit too bright for my liking  cute top though  for reference i m a usually small  i m 5 4  and a small fit perfectly ,4,1,0,General Petite,Tops,Knits,13.19,,,"['simplicity', 'fit', 'color', 'color', 'style', 'top', 'fail', 'liking', 'top', 'size', 'reference point', 'cute', 'orange', 'bit', 'bright']"
860,42,,nan,5,1,0,General Petite,Tops,Knits,0.0,,,['naan']
860,48,Not a white tee,Ordered the  white  tee  but when it arrived today  i was surprised by how cream it looked the cut is nice and as other reviewers mentioned  it is on the sheer side  still on the fence of whether or not i ll keep it ,4,1,0,General Petite,Tops,Knits,1.2,Surprise,,"['tee', 'reviewer', 'cream', 'fence', 'll.', 'side', 'rank', 'skillful', 'cutting', 'white']"
862,58,Generously sized,I am short  on the heavy side  5 1  156 lbs  i always wear large petite  this beautiful blouse swallows me  lots of fabric on the front side of the shirt  causing a boxy look  i could totally do a mp if not sp  i am going to try and exchange   beautiful blouse  great quality  breathable fabric  colors are deep and rich  so comfy   highly recommend ,5,1,2,General,Tops,Knits,4.3,,,"['blouse', 'fabric', 'shirt', 'petite', 'quality', 'melting point', 'colours', 'breathable', 'comfortable', 'side', 'front', 'rich', 'beautiful', 'heavy', 'large']"
860,29,Nice structure,Good structure and quality  a bit large and wish i had ordered something a bit brighter   i ordered the white tee  ,3,1,1,General Petite,Tops,Knits,5.09,,Organization,"['tee', 'large', 'quality', 'architecture', 'bit', 'bit', 'white', 'fine']"
862,36,,Adore the rust color in this top  very pretty rust color  would go with a lot of stuff  my only small pet peeve with the shirt is the opening under the hook and eye  i have been wearing a seamless tank underneath  but everything else about the blouse fits so perfect  drapes nicely that i think the opening is a minor thing that a tank top can fix  beautiful on  felt that it fit tts  i m usually a 34b  got an xs in this top ,5,1,3,General,Tops,Knits,16.0,,,"['rust', 'blouse', 'drape', 'tank top', 'hook and eye', 'shirt', 'tank', 'pet peeve', 'color', 'many', 'seamless', 'open', 'aperture', 'else', 'minor']"
860,53,Great all around top,I have this top in orange and white  it is a great top to throw on with jeans  don t put it in the dryer  will shrink ,4,1,0,General Petite,Tops,Knits,-4.4,,,"['jeans', 'top', 'dryer', 'don', 'top', 'orange', 'white', 'great']"
862,59,Cute shirt,The material is more like a great tee for the sleeves and the back  so it is so comfortable  i agree with the previous review  i am not thrilled about the hook and eye  but it still looks cute with a tank under it  i bought it in black and i am ordering it as well in white  it looks great with skinny jeans or pants ,5,1,0,General,Tops,Knits,2.2,Like,,"['skinny jeans', 'hook and eye', 'arm', 'trousers', 'material', 'tee', 'back', 'tank', 'review', 'black', 'cute', 'great', 'comfortable', 'old', 'white']"
860,39,,nan,5,1,0,General Petite,Tops,Knits,0.0,,,['naan']
862,37,,nan,5,1,0,General,Tops,Knits,0.0,,,['naan']
862,35,Love this top,I love this top    i just had a baby and it is difficult to balance classy with comfortable with out looking sloppy  this top is perfect  it may run a tiny bit big but for the most part it is true to size  great for busty girls  36dd  ,5,1,0,General,Tops,Knits,18.39,,,"['baby', 'miss', 'size', 'sloppy', 'classy', 'busty', 'tiny', 'comfortable', 'difficult', 'perfect', 'top', 'bit', 'true', 'large']"
860,45,Color,The color is as pictured  like a deep coral  very comfy and great drape ,5,1,4,General Petite,Tops,Knits,38.4,,,"['color', 'drape', 'coral', 'comfortable']"
862,64,Much cuter in person,I didn t pay much attn to this online  i m not much on front hook   tie closures  well  saw today at the local store   decided to try on both the s   m  i am usually a s in tops  but the m was only a bit more roomy   longer than the s  so i went with the size m  i thought the styling of it paired well w  the pilcro cord skinnys i had on  looked much better than the pics online  i have other pilcro skinny cords   jeans in vs colors so i think this top will work out well for me  love the 3 4 sleev,5,1,2,General,Tops,Knits,14.3,,,"['jeans', 'styling', 'cord', 'dirt', 'tie', 'skinny', 'store', 'top', 'photo', 'well', 'size', 'cord', 'will', 'closure', 'foremost']"
862,59,Good everyday shirt,I m glad this was on sale because i would not have purchased it at full price due to the strange fit in the sleeve  the shirt has a slight raglan sleeve  but the sleeves do not fit loosely  they kind of twist under the armpit area  i do not have large arms  so i am ok with straightening out the knit sleeves  but they do not fit right  i also was surprised at the unfinished edge along the neckline  it is messy and tacky looking  but i think that is how it was meant to be  my recommendation to buy,3,1,0,General,Tops,Knits,-4.8,Surprise,Disorganization,"['raglan sleeve', 'arm', 'shirt', 'sleeve', 'neckline', 'price', 'knit', 'armpit', 'weapon', 'unusual', 'gladiolus', 'recommendation', 'unfinished', 'messy', 'tacky']"
888,54,Nice top,A cute top  slightly tight in the upper area  debated returning but decided to keep as the top is unique and i know that i will wear it frequently  aleardy thinking of way to wear all year around  runs small,5,1,0,General,Tops,Knits,0.69,,,"['small', 'class', 'cute', 'top', 'thinking', 'tight', 'area', 'all', 'top', 'upper', 'unique']"
888,26,Good but runs very small,Retailer sizes are all over the place  i fell in love with this top  and tried it a couple of times to see if it would work  unfortunately i have to send it back  the design and colors are very good  the side slits are very high  right up to the waist  but the top still looks good  unfortunately it is very small  it still fits because of the long side slits  and is not that tight at the top due to sleeveless  but the fit just wasn t as flattering  it does seem to run 1 2 sizes small  so i a,4,1,1,General,Tops,Knits,-4.3,Love,Pleasantness,"['notch', 'waist', 'design', 'fit', 'retailer', 'couple', 'sizing', 'size', 'look', 'hour', 'sleeveless', 'color', 'side', 'top', 'little']"
