Clothing ID,Age,Title,Review Text,Rating,Recommended IND,Positive Feedback Count,Division Name,Department Name,Class Name,sentiment_overall,emotional_traits,behavioral_traits,concepts
862,45,Cute top!,I m either a medium or large in retailer tops  i was able to wear a medium in this top  the color is vibrant and the material is soft and light  it will be a great spring and summer top  can t wait to wear it ,5,1,1,General Petite,Tops,Knits,0.2,,,"['regular', 'material', 'spring', 'summer', 'media', 'can', 'light', 'color', 'retailer', 'bright', 'top', 'soft', 'able', 'top']"
862,48,,This t shirt does a great job of elevating the basic t shirt in to one with a touch of flair  i typically wear a medium but luckily read earlier reviews and went with the small ,4,1,0,General Petite,Tops,Knits,3.0,Satisfaction,,"['jersey', 'regular', 'job', 'small', 'genius', 'touch', 'review', 'basic', 'great']"
872,30,"Good concept, poor product",I loved the aesthetic but as a true hourglass shape  i was frustrated that it didn t have a little more give as i tried to pull it over my head  the fabric was stiff  and seemed to be lace over cotton  not entirely sure  i couldn t get past the feeling off the material ,2,0,0,General Petite,Tops,Knits,1.2,Stress,,"['fabric', 'lace', 'cotton', 'material', 'hourglass', 'head', 'form', 'feeling', 'standup', 'sure', 'esthetic', 'real']"
862,53,Cute but....,I saw this top on sale and tried it on right away  my normal medium was too big  so i purchased the small in the rose color  wore it with a shimmery kimono and cream colored pilcro boyfriend jeans  wow  what an outfit      then i washed it according to directions  and sadly it shrunk into a crop peplum tank  i was so disappointed  i wished i had read the reviews beforehand ,3,0,4,General,Tops,Knits,-1.39,Sadness Disappointment Surprise,,"['jeans', 'wow', 'peplum', 'outfit', 'small', 'kimono', 'cream', 'crop', 'rose', 'tank', 'direction', 'review', 'boyfriend', 'shimmering', 'bleached']"
862,49,Shrinks,I m 5 4  125 lbs    have a 36 c d bust  the xs fits great   i wash everything in cold   line dry    this was no exception  when i took it out of the washer i knew immediately    i ve pulled it back into shape   hung it up  but we ll see    dry clean if you want to keep it,4,1,7,General,Tops,Knits,1.39,,,"['great', 'll.', 'exception', 'line', 'washer', 'form', 'no', 'cold']"
872,36,Lovely and so flattering,I purchased this with some hesitation  having read that some people thought it was unflattering  but i couldn t resist the sale price  and i love a low maintenance work top and doesn t require ironing  this fits the bill perfectly  it s made of high quality fabric  there s a soft inner lining with a side zip closure  and it has a pretty narrow profile so initially i found it a little snug to wiggle into  i got a small   but once on it fit perfectly  and is so flattering i can t imagine why other,5,1,1,General Petite,Tops,Knits,22.5,,Disagreement Rejection Healthy lifestyle,"['maintenance', 'fabric', 'work', 'zip', 'sale price', 'lining', 'hesitation', 'profile', 'high quality', 'people', 'closure', 'unflattering', 'cosy', 'piano', 'inner']"
872,41,,Dig this top but a little different from what i was expecting  the outside is indeed a bit stiff and scratchy but it is lined     but definitely would ve appreciated a softer fabric  however  the cut is cute and flattering and the pattern is adorable so it s staying in my closet  perhaps not the thing to wear to snuggle up with someone though ,4,1,0,General Petite,Tops,Knits,10.3,Like,,"['fabric', 'pattern', 'stiff', 'outside', 'hairstyle', 'closet', 'flattering', 'adorable', 'itchy', 'different', 'cute', 'bit', 'cover', 'soft', 'thing']"
862,42,Too big!,I wear a size 4 and i ordered the small for this top  it is huge and gave me a maternity look that i wasn t going for  i was hoping for a loose  body skimming fit as shown on the model in the picture but that wasn t happening with this top ,3,0,10,General,Tops,Knits,3.29,,Organization Unlawfulness,"['maternity', 'small', 'skimming', 'size', 'photo', 'mannequin', 'body', 'huge', 'top', 'loose']"
862,57,,Love this layering piece  a little low cut for my personal comfort  but a tank underneath works great ,5,1,0,General,Tops,Knits,27.29,,,"['low', 'comfort', 'tank', 'piece', 'brief', 'personal']"
872,26,,nan,3,0,0,General Petite,Tops,Knits,0.0,,,['naan']
872,23,Love!,I was very nervous to buy this top  but because it was on such an excellent sale i went for it  tops like this usually end in me showing a ridiculous amount of cleavage or not being able to zip  i am a 32ddd  it past my waist  i ordered a small based on the other reviews and it fits perfectly  the wrap top is perfect and shows off my curves without showing too much  the fabric is very unique and the whole top is lined with a nice nylon cotton blend so it is very soft and comfortable to wear  def,5,1,0,General Petite,Tops,Knits,4.69,Anxiety,Apprehension,"['fabric', 'top', 'cotton blend', 'wrapper', 'waist', 'small', 'nylon', 'cover', 'curve', 'sale', 'cleavage', 'total', 'review', 'ridiculous', 'nice']"
872,42,Too cute but ...,Super cute  flattering design but the material is itchy so it s going back  ,3,0,0,General Petite,Tops,Knits,-5.5,,,"['pattern', 'material', 'flattering', 'cute', 'itchy']"
862,23,My go-to shirt,I honestly bought this shirt on a whim the other day in my local retailer  i was drawn to the color and the swing  first of all  this shirt is incredibly soft and lightweight  i love the flow of the loose peplum  the straps are nicely placed  because they re wider and accentuate my arms  and cover my bra straps   i love the little v neck detail  it shows a little cleavage when bent or hunched over  but the top stays conservative when truly upright  i wore this shirt 3 days in a row last week  and,5,1,21,General,Tops,Knits,2.2,,Honesty,"['shirt', 'strap', 'cleavage', 'peplum', 'bra', 'flow', 'impulse', 'retailer', 'week', 'neck', 'arm', 'corset', 'detail', 'swing', 'lightweight']"
862,64,Versatile!,This top is comfortable and flattering  i really like the simplicity  a wearable basic summer top  with a cute twist  just enough to make it contemporary  but not overstated ,5,1,0,General,Tops,Knits,45.2,Like,,"['simplicity', 'flattering', 'cute', 'comfortable', 'twist', 'cover', 'contemporary']"
872,36,Poor fabric quality,Looks great in the picture but when i got this in the mail the fabric was so stiff  shaking it out did nothing almost like it was dipped in drying glue  i got this for  10 which is so cheap and i still returned it ,1,0,0,General Petite,Tops,Knits,-0.89,,,"['fabric', 'glue', 'picture', 'stiff', 'post', 'cheap']"
862,21,Perfect shirt,I absolutely adore this shirt    the pinkish rosey color is beautiful and ended up being better than i had imagined  i will say that the shirt is a bit more casual than i thought it was going to be  the way it hangs or something  not really sure  nonetheless  it is perfect  can be dressed up or down  which is the best quality to have in any piece of clothing  i can tell i m going to get a lot of wear out of it ,5,1,0,General,Tops,Knits,21.29,,Insecurity,"['shirt', 'clothing', 'pink', 'clothing', 'many', 'quality', 'color', 'ended', 'beautiful', 'way', 'casual', 'bit', 'good', 'sure', 'piece']"
872,32,Very cute,Very versatile top  i feel like i could dress it up or down  fits very nice and the material is soft ,5,1,0,General Petite,Tops,Knits,13.89,,,"['material', 'nice', 'versatile', 'soft']"
862,37,Good summer tank,This will be a great summer staple   good fit and very comfortable   may go back and buy another color,5,1,0,General,Tops,Knits,23.1,,,"['summertree', 'staple', 'color', 'comfortable', 'great', 'good']"
862,28,"Shrinks, shrinks, shrinks",I purchased this top in the rose and steel blue colors even though the majority of reviews says it shrinks even when you wash per the instructions  i called the local retailer store first to see if it could be returned if this happened and they said yes  no problem  well the reviews are correct  i washed just the rose colored top so i could compare it to the steel blue if it did shrink  i am returning them this evening  i will not take the time or spend the money to dry clean a tank  it is made ve,1,0,1,General,Tops,Knits,0.0,,,"['store', 'steel blue', 'retailer', 'top', 'majority', 'review', 'rose', 'education', 'rose', 'color', 'wellspring', 'yes', 'currency', 'problem', 'tank']"
872,36,Upholstery fabric,Super thick material and it s lined with cotton so as not to be scratchy on the skin  it looks cute on  hopefully it will soften over time  almost thick like upholstery fabric ,4,1,1,General Petite,Tops,Knits,2.79,,Positivity,"['fabric', 'cotton', 'material', 'upholstery', 'skin', 'itchy', 'cute', 'time', 'thick', 'thick']"
862,34,,Has anybody washed this shirt a second time  just curious if it continues to shrink ,3,0,0,General,Tops,Knits,-9.8,,Curiosity,"['shirt', 'curious', 'time']"
862,66,"Loved it, but...",I fell in love with this cute top  however after reading reviews  i am going to return it  seems there is a problem with it shrinking after following washing instructions  who wants to dry clean a tank top  not me  sadly  too bad  style was cute and color was awesome ,2,0,2,General,Tops,Knits,-7.3,Sadness Like Love,,"['tank top', 'education', 'color', 'problem', 'reading', 'following', 'style', 'too bad', 'review', 'cute', 'awe-inspiring', 'cute', 'cover']"
862,84,Wanted to love,I wanted to love this top  the color is wonderful in the pink and the material is silky soft  it is huge though  i am a 34 dd and bought my usual small  i am going to exchange for an xs and am hoping it fits ,3,1,1,General,Tops,Knits,3.2,,,"['textile', 'color', 'silky', 'pink', 'fantastic', 'huge', 'soft', 'usual']"
872,56,Not kind to curves,Wanted to love this top  and could imagine lots of outfits with it  the wide shoulders made my arms shoulders look big  the ruching and extra flap landed at an odd place  accentuating my belly  it did arrive very wrinkled  although a previous reviewer said she found it to be a wrinkle free garment  maybe that made the look worse  overall i felt that it made me look 15 lbs heavier than i am  so back it goes  i am 5 7   160lbs  34dddd  and the size large was the correct size ,2,0,7,General Petite,Tops,Knits,5.3,,,"['shoulder', 'flap', 'arm', 'garment', 'belly', 'large', 'reviewer', 'shoulder', 'ruching', 'size', 'look', 'worse', 'look', 'locality', 'outfit']"
862,35,Cute top....but shrinks horribly!,I bought this top and it ran huge  i had to get an extra small  well then i wash it according to the instructions and it shrunk horribly  like its so small now my 3 yr old could probably wear it  i m so sad  i really liked this top    but for it to shrink after one wear is not acceptable ,1,0,10,General,Tops,Knits,4.0,Sadness Like,,"['extra small', 'year', 'education', 'sad', 'acceptable', 'top', 'huge']"
862,60,Great tank,For me to buy a tank top it better be special and this is  flattering without being skintight  it camouflages that little back bacon you sometimes get from a bra  the v neck is low and is the same in the back  great length  super soft and the best part is you can wear a bra  i haven t washed this yet  but based on other reviews i ll probably hand wash and air dry  the only issue is the tag flops out every now and then ,5,1,0,General,Tops,Knits,3.5,,,"['bra', 'haven', 'neck', 'back bacon', 'tank top', 'hand wash', 'll.', 'flop', 'length', 'review', 'issue', 'skintight', 'rear', 'only', 'fine']"
872,34,Flattering a comfortable,This top looks just as it does on the model and it fit just as they said it would  i needed a nice shirt to wear with jeans and camouflage my new mommy tummy and this was perfect  it s really comfortable and fun  too ,5,1,0,General Petite,Tops,Knits,11.0,Amusement,,"['tummy', 'shirt', 'jeans', 'mom', 'fun', 'look', 'model', 'nice', 'comfortable', 'perfect']"
862,54,,I love everything about this top  the fabric  the color  the fit  great top for spring and summer ,5,1,0,General,Tops,Knits,5.09,,,"['fabric', 'top', 'spring', 'cover', 'summer', 'color', 'fit', 'great']"
872,25,Fabric is very stiff....,I had hopes for this shirt but was disappointed in the fabric   it s very stiff and heavy for a summer blouse  will be returning it ,1,0,0,General Petite,Tops,Knits,-36.2,Disappointment,,"['blouse', 'shirt', 'fabric', 'hope', 'summer', 'frustrated', 'starchy', 'heavy']"
872,38,,This top is super cute and is very flattering  however  i have trouble getting in and out of it  there is one zipper on the side but it almost seems like it needs to go higher up in order to help you put it on and take it off ,4,1,2,General Petite,Tops,Knits,7.3,,,"['zip', 'trouble', 'flattering', 'cute', 'cover']"
872,21,The perfect purple piece,I got the dark purple color of this top and it is perfect  i wear it all the time  it s comfortable and it s cute  plus if it gets cold i can throw a warm sweater on top of it ,5,1,0,General Petite,Tops,Knits,3.0,,,"['sweater', 'color', 'purple', 'warm', 'top', 'dark', 'cute', 'comfortable', 'top', 'perfect']"
872,30,Great every day long-sleeved tee,I absolutely love this tee  i normally don t buy two of the same thing  but i bought it in both black and mauve during a december sale  i ordered a size small  and it fits tts  it can be worn with leggings or skinny jeans cords  i love pairing it with skinny jeans and boots best  it s very slimming and so soft ,5,1,0,General Petite,Tops,Knits,11.1,Like,Organization,"['skinny jeans', 'leggings', 'small', 'boot', 'sizing', 'tee', 'cord', 'two', 'thing', 'both', 'mauve', 'black', 'same', 'soft']"
872,60,Amazing!,This tee is amazing  it is so soft and comfortable  and is great for those of us who are tall  it has great length  i went with a medium because i didn t want it too tight  i really hope that retailer restocks soon because i want to buy one in every color ,5,1,0,General Petite,Tops,Knits,13.89,,,"['tee', 'retailer', 'length', 'outstanding', 'comfortable', 'medium', 'color', 'great', 'great', 'soft', 'tall']"
872,29,,Super comfortable   i am 34 weeks pregnant and i works great for me now and i think it will be perfect post baby also ,5,1,0,General Petite,Tops,Knits,10.89,,,"['baby', 'post', 'week', 'comfortable', 'meaning', 'perfect']"
872,68,Best basic ever,Like the other reviewers  this is my new favorite tee  it s so freaking soft  and the ribbon down the back just gives a little added flare  pure good has been one of my staple brands for basics for a while  and i will definitely be buying more colors in this  the length is perfect for leggings  and it would be cute with jeans too ,5,1,3,General Petite,Tops,Knits,-4.3,,,"['good', 'brand', 'leggings', 'color', 'jeans', 'ribbon', 'flare', 'staple', 'length', 'back', 'favourite', 'reviewer', 'basics', 'more', 'complete']"
872,35,Perfect until washed,Loved this shirt so much that i bought in 3 colors  love the luxurious feel of the silky  flowing fabric that flatters in all the best ways  however  after washing per instructions  the fabric lost its good qualities and turned into a blah  pilled mess that gathers at the seams  especially the bottom seam   tried dry cleaning another shirt and it came out the same way as washing  looks like a cheap  lackluster layering top now and definitely won t last another season  so disappointed   if you ca,3,0,0,General Petite,Tops,Knits,7.19,Disappointment,,"['fabric', 'dry cleaning', 'shirt', 'bombast', 'wrinkle', 'feel', 'quality', 'layering', 'silky', 'education', 'seam', 'season', 'bottom', 'luxurious', 'lackluster']"
867,53,,Cute top and flattering to wear  fits nicely and i d say true to size  can t wait to wear it ,5,1,0,General,Tops,Knits,-3.7,,,"['wait', 'fit', 'size', 'cute', 'true']"
872,25,Soft & versatile tee,Purchased in the light grey and was so excited  i wore it the very next day  the back detailing and pocket make it more unique than a regular tee and the fabric is slightly heavy  in a good way  so it hangs beautifully  easily can be dressed up or down  new favorite tee ,5,1,0,General Petite,Tops,Knits,6.69,Excitement,,"['fabric', 'tee', 'scoop', 'visible light', 'detailing', 'grey', 'back', 'activated', 'way', 'unique', 'favourite', 'regular', 'heavy', 'good']"
872,62,Need them all!,Ordered this on a whim while taking advantage of a promotion  and now need one in every color  the weight and cut is perfect for fall winter summer   not too heavy  but not sheer tissue thin  fitted enough to look super cute with leggings or skinny jeans  fabric has a nice quality feel to it   i have similar shirts from the past that have held up well in the wash  i m anticipating the same with this ,5,1,1,General Petite,Tops,Knits,15.0,,,"['shirt', 'fabric', 'skinny jeans', 'tactile property', 'leggings', 'tissue', 'winter', 'quality', 'past', 'summer', 'washing', 'autumn', 'impulse', 'weight', 'promotion']"
872,35,Best. tee. ever.,Oh my  i love this tee  it is super soft  i love how it doesn t look like a sack with no shape  i can t wait to get more colors  i am tall plus have a long torso and it still is long enough for me so this is definitely a win ,5,1,0,General Petite,Tops,Knits,9.39,,,"['wait', 'tee', 'torso', 'sack', 'win', 'shapes', 'colours', 'no', 'tall', 'soft']"
872,65,,nan,5,1,0,General Petite,Tops,Knits,0.0,,,['naan']
872,30,Comfort and style to the max!,Love this shirt  i am 5 8 and have a slender torso and the small fits perfectly  i love that it s long so you can wear it as a single shirt or use it as an extra layer  i also have a grey druzy necklace to dress this puppy up  purchased it in black and this will be a new staple ,5,1,0,General Petite,Tops,Knits,11.0,,,"['shirt', 'torso', 'puppy', 'fit', 'necklace', 'staple', 'layer', 'black', 'slender', 'minor', 'excess', 'grey']"
872,48,Nice but 5% spandex makes it a bit clingy,This top is much nicer than expected     the fabric and style are great  i am a size small or medium  and got the small  from the front  it was great  not so much from the back for me  i m larger on top than bottom and the 5  spandex made it too clingy around the dreaded bra fat area  i don t wear spanx  i wish retailer would be more specific with the fabric content  if i d known it was 5  spandex  i would have ordered a size medium  i am thinking about doing this because the top is really,4,1,2,General Petite,Tops,Knits,4.09,Repulsion,,"['spandex', 'fabric', 'small', 'regular', 'bra', 'wear', 'size', 'retailer', 'trend', 'size', 'back', 'content', 'clingy', 'bottom', 'dire']"
867,53,Confortable - simple,This top is so soft and comfortable  i bought it on sale  so would i have paid  60 for it         not sure  fits true to size  what can i say its a simple top  well made and so soft ,5,1,0,General Petite,Tops,Knits,14.89,,Dishonesty,"['well', 'size', 'for sale', 'comfortable', 'top', 'simple', 'soft', 'true', 'top', 'soft']"
872,33,Luxurious basic tee,I love simplicity in clothing and this tee fits the bill  i put it on and instantly feel basic elegance ,5,1,0,General Petite,Tops,Knits,16.7,,,"['simplicity', 'elegance', 'tee', 'clothing', 'basic']"
872,49,Awesome shirt,I am 5 10   130 pounds  a medium is a perfect fit for me  i love it  not so sheer that i feel that i need to wear a cami underneath  sleeves are long  and it is so  so  so soft  the scoop neck shows just the right amount without being too revealing  i am buying one in every color ,5,1,0,General,Tops,Knits,6.09,Like,,"['scoop neck', 'camisole', 'sleeve', 'media', 'amount', 'fit', 'color', 'revealing', 'rank', 'soft', 'perfect', 'long', 'right', 'every']"
867,36,Beautiful,Fits great  love soft material  love with skinny jeans brown boots,5,1,0,General Petite,Tops,Knits,35.29,Love,,"['boot', 'dear', 'skinny jeans', 'material', 'soft', 'brown']"
876,51,Lovely detail,I was pleasantly surprised when i tried this on  i tried it because of the detail but didn t hold out much hope because it looked frumpy on the hanger  i was very wrong  it fits beautifully  it drapes nicely  hugs the shoulders perfectly and doesn t droop open due to the embellishments  there is a tiny closure where the fabric crosses in the front so you are not exposed  i liked that feature very much  the sleeves are 3 4 on me  but i like it   nice change of pace  this is a very different style,4,1,0,General Petite,Tops,Knits,14.8,Surprise Like Affection,,"['fabric', 'sag', 'arm', 'embellishment', 'shoulder', 'blockage', 'hanger', 'change of pace', 'feature', 'way', 'detail', 'frumpy', 'tiny', 'surprised', 'courteous']"
867,35,Comfortable top,This top feels great on  it just drapes well and isn t clingy  i refused to buy maternity tops  because i wanted to wear the tops after pregnancy  though i bought this top post pregnancy it would have worked great because of the length ,4,1,0,General Petite,Tops,Knits,3.59,,Rejection,"['maternity', 'top', 'feel', 'pregnancy', 'length', 'clingy', 'slot', 'foremost', 'top']"
872,38,Favorite go to top,Comfortable casual  hip  i have the black   white color which is a bit thicker than the other colors which i prefer as i recently had a baby and need a little extra fabric  i wish the fabric was a bit softer but the cut is so flattering there was no way i was sending it back  i wish the other colors were in the same thicker fabric and i would have ordered more  my new go to top  the black ribbon on the back is my favorite part ,5,1,0,General,Tops,Knits,1.79,,,"['fabric', 'no way', 'hairstyle', 'building', 'color', 'ribbon', 'hip', 'color', 'baby', 'bit', 'bit', 'back', 'white', 'other', 'black']"
867,63,Cutest ever!,This is one of the cutest tops i ve ever gotten from retailer  the material is very soft and flowing  it fits true to size and hange beautifully  love it  i should have gotten he turquoise one too ,5,1,1,General Petite,Tops,Knits,4.19,Like,,"['turquoise', 'retailer', 'material', 'size', 'cute', 'soft', 'cover', 'true']"
872,28,,Love this shirt  it fits great and can be easily layered ,5,1,1,General,Tops,Knits,65.8,,,"['shirt', 'layered']"
872,32,,Agree with the other reviewers  this top is excellent  great length  weight   bounce to it  flattering without being clingy  i m 5 10  with a long torso  so i m always in the market for tops with longer hemlines and decent material without being too tight or clingy  this one i love  i bought it in black  then went back for the turquoise  then two more    if that doesn t tell you what a great shirt this is  i don t know what will ,5,1,0,General,Tops,Knits,13.69,,,"['bounce', 'hem', 'reviewer', 'top', 'torso', 'turquoise', 'market demand', 'shirt', 'weight', 'material', 'black', 'length', 'clinging', 'clingy', 'enough']"
872,44,Too long,Great color  soft fabric  but waaaaay too long  more like a night shirt than a t shirt ,2,0,1,General,Tops,Knits,-5.59,,,"['shirt', 'fabric', 'jersey', 'night', 'color', 'great', 'soft']"
872,26,Oversized and unflattering,I was hoping to find a slimming and cozy sweater  unfortunately this one was baggy and material was really bulky  one of those occasions where i would have never purchased this in person but online you can t quite tell the style and fit  i returned this item ,3,0,0,General,Tops,Knits,0.69,,,"['sweater', 'material', 'occasion', 'slimming', 'style', 'cosy', 'baggy', 'bulky', 'detail']"
872,42,,I need one in every color  so super soft ,5,1,1,General,Tops,Knits,0.0,,,"['color', 'every', 'soft']"
876,48,,Very pretty blouse with nice detail  needs to be worn with a camisole however ,4,1,0,General Petite,Tops,Knits,20.79,,,"['blouse', 'camisole', 'detail', 'pretty', 'nice']"
872,32,,Got this shirt on sale and i hope they restock so i can buy more  super comfy and flattering at the same time  i have some extra baby weight and it camouflages that well  i m normally a 6 8 but i m an 8 10 right now and the medium was perfect  i m 5 6  and its plenty long enough to wear with leggings  a great shirt and i ll be sure to watch out for this one to come back  please restock ,5,1,0,General,Tops,Knits,0.3,,,"['shirt', 'll.', 'well', 'leggings', 'weight', 'comfortable', 'baby', 'flattering', 'for sale', 'medium', 'other', 'sure', 'complete', 'right', 'some']"
872,32,Perfection,I almost never take the time to write reviews but this shirt is amazing    it s a super soft  stretchy  substantial fabric that is incredibly flattering  it falls perfectly and is insanely comfortable  i am 5 5  120 lbs and usually wear an xs or s in retailer tops    i went with the xs and it is a perfect fit  love it so much i bought it in 4 colors    i am now completely broke but these shirts will be in constant rotation ,5,1,0,General,Tops,Knits,33.9,Like,,"['fabric', 'shirt', 'critique', 'color', 'fit', 'rotation', 'stretchy', 'retailer', 'strong', 'soft', 'outstanding', 'comfortable', 'perfect', 'top', 'invariant']"
867,51,Very pretty top,This is a beautiful top  however  my top did not match the one in the picture  it s so odd  the stripes are completely different  it s ok  because it s very pretty  but i do like the one pictured better  it s too short on me for leggings and boots  but it s great with skinny jeans  very pretty and soft material ,4,1,0,General Petite,Tops,Knits,24.2,,,"['one', 'stripe', 'top', 'leggings', 'skinny jeans', 'boot', 'cover', 'picture', 'material', 'pretty', 'all right', 'pretty', 'beautiful', 'different', 'soft']"
